{
  "format_version": 1,
  "kind": "work-reflection",
  "id": "reflection:test-failure:2",
  "work_unit_id": "wu:reflection-demo",
  "run_id": "run:reflection-demo",
  "attempt_id": "attempt:implement:1",
  "trigger": {
    "kind": "human_request",
    "summary": "A reviewer requested a second reflection over the same failed attempt with additional repository evidence.",
    "evidence_refs": ["evidence:test-failure", "evidence:repository-query-contract", "evidence:adapter-source"],
    "finding_refs": ["finding:test-failure"]
  },
  "status": "completed",
  "observation": {
    "failure_or_risk": "The original diagnosis remains valid, but the additional adapter source confirms the normalization gap is intentional rather than accidental.",
    "unsupported_assumptions": [
      "The adapter was expected to normalize presentation labels."
    ]
  },
  "causes": [
    {
      "summary": "The implementation crossed a strict domain-to-query serialization boundary with a presentation label.",
      "confidence": 0.97,
      "evidence_refs": ["evidence:repository-query-contract", "evidence:adapter-source"]
    }
  ],
  "corrections": [
    {
      "id": "correction:canonical-orientation:confirmed",
      "summary": "Keep the correction at the query boundary and preserve the adapter's strict canonical token contract.",
      "scope": "task",
      "action_ref": "action:fix-orientation",
      "next_attempt_ref": "attempt:implement:2"
    }
  ],
  "provider": {
    "kind": "human",
    "connection_id": null,
    "name": "reviewer",
    "model": null,
    "version": null
  },
  "confidence": 0.97,
  "evidence_refs": ["evidence:test-failure", "evidence:repository-query-contract", "evidence:adapter-source"],
  "resulting_action_ref": "action:fix-orientation",
  "next_attempt_ref": "attempt:implement:2",
  "memory_candidate_refs": ["memory-candidate:strict-query-boundary"],
  "prior_reflection_ref": "reflection:test-failure:1",
  "created_at": "2026-09-21T20:07:00Z"
}
