{
  "format_version": 1,
  "kind": "work-reflection",
  "id": "reflection:abstained:1",
  "work_unit_id": "wu:reflection-demo",
  "run_id": "run:reflection-demo",
  "attempt_id": "attempt:performance:1",
  "trigger": {
    "kind": "low_confidence",
    "summary": "The evaluator requested reflection because performance impact remained ambiguous.",
    "evidence_refs": ["evidence:partial-benchmark"],
    "finding_refs": []
  },
  "status": "abstained",
  "observation": {
    "failure_or_risk": "The available benchmark is too narrow to support a causal conclusion.",
    "unsupported_assumptions": []
  },
  "causes": [],
  "corrections": [],
  "provider": {
    "kind": "agent",
    "connection_id": "agent:codex-local",
    "name": "codex",
    "model": null,
    "version": null
  },
  "confidence": null,
  "evidence_refs": ["evidence:partial-benchmark"],
  "resulting_action_ref": null,
  "next_attempt_ref": null,
  "memory_candidate_refs": [],
  "prior_reflection_ref": null,
  "created_at": "2026-09-21T20:06:00Z"
}
